Video Heading,Total Views,Video Uploaded,Video Link
PRINCESS GETS READY FOR SCHOOL ✨ Magical DIY Ideas For Parents,12K views,2 hours ago,https://www.youtube.com/watch?v=f95bJYP3Qew
FUN SCHOOL GADGETS AND DRAWING IDEAS,149K views,22 hours ago,https://www.youtube.com/watch?v=_HJJP7DE2s4
EMERGENCY HACKS FOR PARENTS || Smart Parenting Guide,87K views,1 day ago,https://www.youtube.com/watch?v=EWvEPyHyfvQ
RICH vs POOR || VIRAL SCHOOL HACKS AND CRAFTS,210K views,1 day ago,https://www.youtube.com/watch?v=4HRC_HaPk2s
EASY DOLL DIYS || Amazing Doll Transformations,96K views,2 days ago,https://www.youtube.com/watch?v=Evs6uPiS_nU
I MADE A PLAYHOUSE FOR MY KIDS! Room Makeover Ideas For Crafty Parents,63K views,2 days ago,https://www.youtube.com/watch?v=XVcMaj0gHHc
ADORABLE SCHOOL CRAFTS YOU SHOULD SEE || EASY SCHOOL HACKS,235K views,3 days ago,https://www.youtube.com/watch?v=-ziPDaqKy1I
FUN FIDGET TOYS || HOW TO ENTERTAIN YOUR KIDS,95K views,3 days ago,https://www.youtube.com/watch?v=JtKXUfmrrTI
HOW TO SNEAK FOOD INTO CLASS? Best School Hacks And Crafts,256K views,4 days ago,https://www.youtube.com/watch?v=QN_Phw31LgE
YUMMY AND EASY SNACK IDEAS YOU SHOULD TRY,102K views,5 days ago,https://www.youtube.com/watch?v=210e57JgIa0
EMERGENCY HACKS FOR ALL OCCASIONS || First-Aid Tips For Smart Parents,298K views,5 days ago,https://www.youtube.com/watch?v=eC5R2Kv_yfY
COOL SCHOOL CRAFTS AND USEFUL STUDY HACKS,194K views,6 days ago,https://www.youtube.com/watch?v=H9Ao9m1jYv0
NEW AMAZING HAIRSTYLE FOR YOUR DOLL || Transformation of doll to Pokemon 💛,176K views,6 days ago,https://www.youtube.com/watch?v=ECXsickGKSc
RAINBOW BATHROOM MAKEOVER 🌈 Genius Cleaning Hacks,134K views,7 days ago,https://www.youtube.com/watch?v=mdGC7el0YPM
FUNNY FINGER DRAWINGS AND DOODLE IDEAS,177K views,7 days ago,https://www.youtube.com/watch?v=c6wguGEfnYo
WOW 🌈 FANTASTIC RAINBOW HACKS AND DIY IDEAS,291K views,8 days ago,https://www.youtube.com/watch?v=aLGAz8vdCFw
AMAZING DOLL CRAFTS || DIY Clothes And Accessories For Dolls,228K views,8 days ago,https://www.youtube.com/watch?v=v700cQ0ZNeM
EASY DRAWING IDEAS AND COOL PAINTING TECHNIQUES FOR BEGINNERS,247K views,9 days ago,https://www.youtube.com/watch?v=DB8clch0Eik
COOL GADGETS AND HACKS FOR SMART PARENTS,163K views,9 days ago,https://www.youtube.com/watch?v=Ml1Rf2itXi8
DIY MINI HOUSE FOR HAMSTER || Building House For Cats And Dogs,58K views,10 days ago,https://www.youtube.com/watch?v=0TwFPVmfuoY
BACK TO SCHOOL! VIRAL CRAFTS AND HACKS FOR SCHOOL,233K views,10 days ago,https://www.youtube.com/watch?v=CYVM8DUcGqw
PINK 💗 or BLACK? 🖤|| Try these RAINBOW Feet Hacks by 5-Minute Crafts,404K views,11 days ago,https://www.youtube.com/watch?v=YqgHuyR2O_M
GENIUS GADGETS AND HACKS FOR YOUR LOVELY PETS,118K views,11 days ago,https://www.youtube.com/watch?v=WPvbssOH7SQ
GENIUS BATHROOM HACKS || DIRTY BATHROOM TRANSFORMATION,185K views,12 days ago,https://www.youtube.com/watch?v=OUyphGztfPA
SMART SCHOOL HACKS AND ART IDEAS,1M views,12 days ago,https://www.youtube.com/watch?v=9mB671lgOBw
100+ SMART HACKS FOR CRAFTY PARENTS,232K views,13 days ago,https://www.youtube.com/watch?v=bA4EOOxWnIc
AWESOME JEWELRY CRAFTS AND MINIATURE IDEAS,70K views,13 days ago,https://www.youtube.com/watch?v=NeUHNCgo8IA
HOW TO SNEAK MAKEUP AND SNACKS || AWESOME FOOD TRICKS,198K views,2 weeks ago,https://www.youtube.com/watch?v=9gtmiMcEwas
USEFUL GARDENING HACKS FOR SUMMER,250K views,2 weeks ago,https://www.youtube.com/watch?v=FbrUJ26Kn9M
My Mom Chooses these Crazy and Smart Gadgets 🎉 || EXTREME PARENTING HACKS from 5-Minute Crafts,166K views,2 weeks ago,https://www.youtube.com/watch?v=kQcPkYSVxI4
GENIUS HACKS AND GADGETS FOR YOUR CAR,325K views,2 weeks ago,https://www.youtube.com/watch?v=gATHW3WHC-8
BEST TRAVEL HACKS FOR PARENTS,123K views,2 weeks ago,https://www.youtube.com/watch?v=bvUfuTJubPk
VIRAL BEAUTY HACKS THAT REALLY WORK,258K views,2 weeks ago,https://www.youtube.com/watch?v=VDEuptvgX1w
UNUSUAL DESSERT RECIPES YOU SHOULD TRY,160K views,2 weeks ago,https://www.youtube.com/watch?v=K5BFqt2iVjo
RICH MOM vs POOR MOM || Smart Parenting Hacks,206K views,2 weeks ago,https://www.youtube.com/watch?v=7JlvDl3MOIU
INCREDIBLE ACTIVITIES FOR EVERYONE || DIY Hacks For Smart Parents,162K views,2 weeks ago,https://www.youtube.com/watch?v=AqCN5JPWBdU
CREATIVE ART IDEAS AND DRAWING TECHNIQUES,273K views,2 weeks ago,https://www.youtube.com/watch?v=b76F8aGKX7Q
GORGEOUS DOLL DIYS || How To Transform An Old Doll,440K views,2 weeks ago,https://www.youtube.com/watch?v=ut0P02wcQZ4
AWESOME KID'S ROOM MAKEOVER || Best Room Transformation Ideas,101K views,2 weeks ago,https://www.youtube.com/watch?v=vzYgOQ6E0D4
DIY SILICONE SHOES! Creative Shoe Crafts And Feet Hacks,317K views,2 weeks ago,https://www.youtube.com/watch?v=t1lBgUbgZ2g
GORGEOUS NAIL DESIGN IDEAS FOR BEGINNERS,316K views,2 weeks ago,https://www.youtube.com/watch?v=IWI5QP19hoE
"OH, NO! My Hamster is Missing 🐹 || Useful hacks and gadgets for your pets by 5-Minute Crafts",111K views,3 weeks ago,https://www.youtube.com/watch?v=cY_COLdXlZg
GORGEOUS DOLL MAKEOVER || DIY Dollhouse Ideas,195K views,3 weeks ago,https://www.youtube.com/watch?v=KzqXrlrx9Ho
BACK TO SCHOOL! Viral School Hacks And Fun DIY Ideas,141K views,3 weeks ago,https://www.youtube.com/watch?v=Hy5Gn9DWJyI
HOW TO BUILD MINIATURE DOLL HOUSE || Best Doll Craft Ideas,96K views,3 weeks ago,https://www.youtube.com/watch?v=JOS_muMD6Oc
GENIUS HACKS FOR YOUR FEET || Useful Shoe Crafts,147K views,3 weeks ago,https://www.youtube.com/watch?v=vJNNpeTFi1M
Fridge Organization And Restocking || Smart Home Organizing Hacks,117K views,3 weeks ago,https://www.youtube.com/watch?v=6ZlXnF4RjTQ
EASY DESSERT RECIPES AND DECORATING HACKS,92K views,3 weeks ago,https://www.youtube.com/watch?v=VNCybmiX3m0
AWESOME DIY SCHOOL SUPPLIES AND ART IDEAS,160K views,3 weeks ago,https://www.youtube.com/watch?v=NlzR6cD5OVI
Adorable Doll Room Makeover|| Fantastic Ideas for Parents,558K views,3 weeks ago,https://www.youtube.com/watch?v=l7QvJ5cLvcY
DIY CRYSTAL SHOES! Amazing Shoe Craft Ideas,482K views,3 weeks ago,https://www.youtube.com/watch?v=iqoA4WG0Hk0
BEST DOLL DIYS || Miniature Clothes And Accessories For Dolls,261K views,3 weeks ago,https://www.youtube.com/watch?v=zJx0-TxD_us
GENIUS HACKS TO KEEP YOUR FEET NICE AND SMOOTH,93K views,3 weeks ago,https://www.youtube.com/watch?v=ZUFfFZvsuDI
CREATIVE DIY IDEAS FOR COOL PARENTS,82K views,3 weeks ago,https://www.youtube.com/watch?v=DPyPs_sb5xo
EASY & FUN DRAWING HACKS FOR BEGINNERS,424K views,3 weeks ago,https://www.youtube.com/watch?v=o393Mnid8jY
Amazing Food Hacks and Recipes || E-Girl VS Soft Girl Cooking Cake,226K views,4 weeks ago,https://www.youtube.com/watch?v=q_b3bwJwT84
SMART SHOE HACKS THAT ARE WORTH TRYING,115K views,4 weeks ago,https://www.youtube.com/watch?v=vQ4rWgH5HXA
100+ GENIUS GADGETS & HACKS FOR SMART PARENTING,181K views,4 weeks ago,https://www.youtube.com/watch?v=Hj35Tu0tP-o
AMAZING DOLL HACKS FOR CRAFTY PEOPLE,513K views,4 weeks ago,https://www.youtube.com/watch?v=g2lUfMRM_uk
FUN FINGER HACKS & DRAWING IDEAS FOR CRAFTY PARENTS,445K views,4 weeks ago,https://www.youtube.com/watch?v=jd1yPiIPms0
GENIUS MAKEUP HACKS TO SPEED UP YOUR BEAUTY ROUTINE,190K views,4 weeks ago,https://www.youtube.com/watch?v=u_V-ls6gTBg
TOP 100 SUMMER HACKS FOR PARENTS,240K views,1 month ago,https://www.youtube.com/watch?v=jBouHL-EaUQ
COZY ROOM IN A WALNUT SHELL?! Incredible Miniature Models,178K views,1 month ago,https://www.youtube.com/watch?v=nbXH0JaYO9k
Doll Comes to Life😮 || SMART GADGETS FOR POSITIVE PARENTING,313K views,1 month ago,https://www.youtube.com/watch?v=DUCzRzoSUMk
AMAZING CEMENT CRAFTS TO DECORATE YOUR HOUSE,163K views,1 month ago,https://www.youtube.com/watch?v=emCDtLjXkRo
100 GENIUS GADGETS FOR SMART PARENTS,127K views,1 month ago,https://www.youtube.com/watch?v=Ja4TblFapuM
COOL DIY PHONE CASES AND PHONE GADGETS YOU SHOULD SEE,171K views,1 month ago,https://www.youtube.com/watch?v=IkX0lsfc93Q
SMART BATHROOM HACKS AND GADGETS YOU SHOULD TRY,120K views,1 month ago,https://www.youtube.com/watch?v=mCeAKV793J8
CUTEST MINI CRAFTS & EASY DIY JEWELRY IDEAS,219K views,1 month ago,https://www.youtube.com/watch?v=EFiNoQyBoMI
COOL RAINBOW CRAFTS AND EASY ART IDEAS,568K views,1 month ago,https://www.youtube.com/watch?v=B8p1jQM0KjY
EASY DIY JEWELRY IDEAS & MINIATURE CRAFTS,426K views,1 month ago,https://www.youtube.com/watch?v=Er3FiX3m2O4
TRENDY GADGETS AND TOYS FOR YOUR PETS,77K views,1 month ago,https://www.youtube.com/watch?v=cZFDJpu8lFw
HOW TO ENTERTAIN YOUR KIDS || Fun DIY Ideas For Parents,68K views,1 month ago,https://www.youtube.com/watch?v=DygGJ2wcydg
POSITIVE PARENTING HACKS || Gadgets For Smart Parents,196K views,1 month ago,https://www.youtube.com/watch?v=l6xZ9pwvKDg
6 MIND-BLOWING MINIATURE HOUSE MODELS,82K views,1 month ago,https://www.youtube.com/watch?v=5kYysRJF4lw
CUTE CRAFTS FOR DOLLS || Amazing DIY Dollhouse,325K views,1 month ago,https://www.youtube.com/watch?v=IhCn2519UFQ
VIRAL SCHOOL HACKS AND BEST ART IDEAS FOR CREATIVE PEOPLE,333K views,1 month ago,https://www.youtube.com/watch?v=5H8yk2n4Go4
HOT🔥 vs COLD❄️ Challenge|| Princess on Fire and Icy Princess Get Out of the Locked Room,455K views,1 month ago,https://www.youtube.com/watch?v=BS7m0ei0yOs
3 AMAZING CAR MINIATURE MODELS,44K views,1 month ago,https://www.youtube.com/watch?v=Lr76bodV0tI
EASY DRAWING HACKS FOR COMPLETE BEGINNERS,406K views,1 month ago,https://www.youtube.com/watch?v=Qd1rhM0UpyU
BEST HACKS TO KEEP YOUR FEET NICE || Comfortable Shoes DIY Ideas,3.1M views,1 month ago,https://www.youtube.com/watch?v=wAfEAMMWVmU
USEFUL HACKS FOR CRAFTY PARENTS || HOW TO MAKE YOUR KIDS HAPPY,671K views,1 month ago,https://www.youtube.com/watch?v=HSVWIHcg5_A
DAD BUILT RAINBOW SECRET ROOM FOR THE WHOLE FAMILY || Bunk Bed House for Siblings!,124K views,1 month ago,https://www.youtube.com/watch?v=xjMr9yvdVkc
EASY GLUE GUN HACKS FOR ALL OCCASIONS,207K views,1 month ago,https://www.youtube.com/watch?v=4njCs_oGRlQ
GORGEOUS DOLL CRAFTS: DIY FURNITURE AND CLOTHES FOR DOLLS,189K views,1 month ago,https://www.youtube.com/watch?v=d2aIpTg9CnA
BACK TO SCHOOL! Best School Supplies And Hacks,106K views,1 month ago,https://www.youtube.com/watch?v=f9jt4QMv1Pk
GORGEOUS DIY JEWELRY IDEAS & MINI CRAFTS,310K views,1 month ago,https://www.youtube.com/watch?v=KQCGjog7SH0
BEST SHOE CRAFTS YOU CAN EASILY REPEAT,328K views,1 month ago,https://www.youtube.com/watch?v=FDNC4Nazt54
AWESOMELY YUMMY FOOD RECIPES | Useful Kitchen Hacks And Gadgets,1M views,1 month ago,https://www.youtube.com/watch?v=m1kX2Kd-3tA
GENIUS SCHOOL HACKS AND CRAFTS TO BECOME THE BEST STUDENT EVER,255K views,1 month ago,https://www.youtube.com/watch?v=O4NjjfB_-dw
HOW TO LOOK COOL WITH HANDMADE JEWELRY | Colorful Resin And Glue Gun DIY Crafts,1.3M views,1 month ago,https://www.youtube.com/watch?v=NcK9SvQyRcg
RAINBOW CRAFTS AND SMART HACKS FOR CREATIVE PARENTS,246K views,1 month ago,https://www.youtube.com/watch?v=njixJWulvWY
BEST GADGETS TO MAKE YOUR PETS HAPPY,142K views,1 month ago,https://www.youtube.com/watch?v=paVl7V5w0vQ
CLEVER SCHOOL HACKS AND CRAFTS EVERY STUDENT WILL LOVE,387K views,1 month ago,https://www.youtube.com/watch?v=9BCjuYJpVG4
COOL MINIATURE IDEAS | Fantastic Parenting Hacks And Colorful DIY Crafts,389K views,1 month ago,https://www.youtube.com/watch?v=a3TdgjSi9Do
Grandma's Secret Recipes: Cooking a Rainbow and Yummy Meal for Beloved Granddaughter,288K views,1 month ago,https://www.youtube.com/watch?v=x-4ZOUxo_Tg
PRICELESS KITCHEN TRICKS AND GADGETS TO COOK LIKE A PRO,196K views,1 month ago,https://www.youtube.com/watch?v=NtaPiI_quSY
BEST PARENTING TUTORIAL | Amazing DIY Crafts And Gadgets For Parents,708K views,1 month ago,https://www.youtube.com/watch?v=VefAN20WKxo
AWESOME BACK TO SCHOOL HACKS & CRAFTS FOR GENIUS STUDENTS,311K views,1 month ago,https://www.youtube.com/watch?v=4GktBVm24UA
CRAZY DOLL MAKEOVER 😱 Best Doll Crafts,241K views,1 month ago,https://www.youtube.com/watch?v=VSHuIW-f8oQ
PARENTING TIPS AND TASTY RECIPES FOR SMART MOMS,400K views,1 month ago,https://www.youtube.com/watch?v=tJyXy7qQvGw
FANTASTIC DRAWING HACKS YOU'LL BE GLAD TO KNOW,220K views,1 month ago,https://www.youtube.com/watch?v=JshX0-BGptg
Epoxy Resin VS Polymer Clay || Cool DIY Ideas,281K views,1 month ago,https://www.youtube.com/watch?v=NXD_KhFHZCU
PRICELESS HACKS FOR SMART PET OWNERS,184K views,1 month ago,https://www.youtube.com/watch?v=ptf7F34LUpM
TEACH YOUR KID ESSENTIAL SKILLS || Smart Parenting Hacks,183K views,1 month ago,https://www.youtube.com/watch?v=MpkqDKAOj60
POP TUBE and Other Rainbow Fidget Toys || HOW TO MAKE FIDGETS FOR FREE,279K views,1 month ago,https://www.youtube.com/watch?v=UPJtqmL2Gks
BACK TO SCHOOL! Viral Hacks And DIY Ideas,756K views,1 month ago,https://www.youtube.com/watch?v=VIkKu-Egkho
"Amazing Experiments That Will Make You Say ""Wow!""",114K views,1 month ago,https://www.youtube.com/watch?v=8E6WxbxBkBs
YUMMY RECIPES FOR CRAFTY PARENTS || Positive Parenting Guide,202K views,1 month ago,https://www.youtube.com/watch?v=ezKw4bEhK4c
50+ GORGEOUS DIY JEWELRY IDEAS,197K views,1 month ago,https://www.youtube.com/watch?v=kOfsGK5xOcg
RAINBOW NERD EXTREME MAKEOVER || *Cheap and Easy Ways to Become Wednesday* by 5 - Minute Crafts,263K views,1 month ago,https://www.youtube.com/watch?v=0RqsPUKEkAU
RICH DOLL vs POOR DOLL || Gorgeous Doll Transformation,301K views,1 month ago,https://www.youtube.com/watch?v=VHhc7u_4oSI
AMAZING MINIATURE CRAFTS || DIYs From Polymer Clay And Epoxy Resin,232K views,1 month ago,https://www.youtube.com/watch?v=ZWsE1-NXd4E
SMART PARENTING HACKS FOR BEGINNERS,279K views,1 month ago,https://www.youtube.com/watch?v=5J_ZAK188es
MUST-TRY VIRAL HACKS FOR ALL OCCASIONS,489K views,1 month ago,https://www.youtube.com/watch?v=EO9J1BBpt3w
3 COOL DIY FIDGET TOYS || How To Transform Old Toys,64K views,1 month ago,https://www.youtube.com/watch?v=Ugk1g2N0ZcA
VIRAL SCHOOL HACKS AND EASY DIY SCHOOL SUPPLIES IDEAS,330K views,1 month ago,https://www.youtube.com/watch?v=nbgpCCVBl4Y
GORGEOUS DOLL CRAFTS || FANTASTIC DOLL MAKEOVER,1.5M views,2 months ago,https://www.youtube.com/watch?v=UbsJaOgq8VI
CUTEST MINI CRAFTS FROM POLYMER CLAY AND EPOXY RESIN,170K views,2 months ago,https://www.youtube.com/watch?v=IchLhxM-auM
Grandma VS Me Сooking Сhallenge || USEFUL KITCHEN HACKS AND GADGETS by 5-Minute Crafts,228K views,2 months ago,https://www.youtube.com/watch?v=Xi9xCBXfsrc
SIMPLE DRAWING IDEAS AND HACKS FOR BEGINNERS,1.6M views,2 months ago,https://www.youtube.com/watch?v=QyGF0xEeVjY
7 CRAZY DOLL TRANSFORMATIONS || Doll Crafts That Will Blow Your Mind,90K views,2 months ago,https://www.youtube.com/watch?v=5akVxP3-Yec
RAINBOW ART IDEAS TO BRIGHTEN UP YOUR DAY,1.5M views,2 months ago,https://www.youtube.com/watch?v=eVRIKwnUsCE
GENIUS GADGETS FOR EASY PARENTING || Useful Parenting Hacks,1.1M views,2 months ago,https://www.youtube.com/watch?v=R8FPBtc12nI
HOW TO SNEAK FOOD AND MAKEUP || Crazy Food Tricks You Will Love,225K views,2 months ago,https://www.youtube.com/watch?v=f1B7BmbBd18
FUNNY AND USEFUL SCHOOL HACKS by 5-Minute Crafts,449K views,2 months ago,https://www.youtube.com/watch?v=VKJTdw6XFgU
AWESOME NAIL DESIGN IDEAS FOR BEGINNERS,92K views,2 months ago,https://www.youtube.com/watch?v=7tzdoOvre4c
BEST SCHOOL GADGETS AND HACKS THAT ARE WORTH TRYING🔥,565K views,2 months ago,https://www.youtube.com/watch?v=e3z_OwXaJYA
CUTE VALENTINE'S DAY SNACKS AND GIFT IDEAS,480K views,2 months ago,https://www.youtube.com/watch?v=vVZrU6_50s0
BEST PET GADGETS AND CRAFTS FOR YOUR FLUFFY FRIENDS,133K views,2 months ago,https://www.youtube.com/watch?v=LFIg1WnhEAE
INCREDIBLE EPOXY RESIN CRAFTS FOR ALL OCCASIONS,1.6M views,2 months ago,https://www.youtube.com/watch?v=clSKir0-aQ4
AWESOME SCHOOL HACKS AND ART IDEAS YOU SHOULD TRY,122K views,2 months ago,https://www.youtube.com/watch?v=K0Zl0mc37F4
HOW TO BE A GOOD PARENT? POSITIVE PARENTING HACKS,217K views,2 months ago,https://www.youtube.com/watch?v=wjsXEaGhba0
WOW! Look at These Rainbow Home Experiments || HURRY UP TO TRY IT!,423K views,2 months ago,https://www.youtube.com/watch?v=wZU_w5zInTU
HUGGY WUGGY TRANSFORMATION || Incredible Toy DIYs,117K views,2 months ago,https://www.youtube.com/watch?v=NB23_3B61ss
"FANTASTIC CRAFTS WITH SILICONE, CEMENT AND EPOXY RESIN YOU WILL LOVE",121K views,2 months ago,https://www.youtube.com/watch?v=Oh5e6I7-EVY
DIY CAT HOUSE 😻 Best Crafts And Gadgets For Your Pets,91K views,2 months ago,https://www.youtube.com/watch?v=CHQLWI5E-QM
FUN AND COOL SCHOOL HACKS TO SURPRISE YOUR CLASSMATES,203K views,2 months ago,https://www.youtube.com/watch?v=1UONWxB_ZM8
POOR DOLL EXTREME TRANSFORMATION TO E-GIRL || Easy and Cheap Makeover Ideas,256K views,2 months ago,https://www.youtube.com/watch?v=uJgkV0pBzaY
FUNNY FINGER HACKS AND DRAWING IDEAS YOU SHOULD TRY,75K views,2 months ago,https://www.youtube.com/watch?v=0w-W1NK2Nm4
DIY CANDY VENDING MACHINE! HOW TO SNEAK SNACKS EVERYWHERE,152K views,2 months ago,https://www.youtube.com/watch?v=odyqs_L6tZY
BEST SCHOOL HACKS & TRICKS YOU SHOULD TRY,131K views,2 months ago,https://www.youtube.com/watch?v=S87uUVzsk4w
WE RESCUED STRAY CAT AND DOG😿🐶 Useful Hacks And Gadgets For Pet Owners,87K views,2 months ago,https://www.youtube.com/watch?v=06IDfaVJxBM
SMART FEET HACKS AND GADGETS TO MAKE YOUR LIFE EASIER,222K views,2 months ago,https://www.youtube.com/watch?v=P5n5NQay_jU
SMART HACKS & GADGETS FOR COOL PET OWNERS,181K views,2 months ago,https://www.youtube.com/watch?v=_urN9XWoZfg
POSITIVE PARENTING HACKS || How To Be Friends With Your Kid,516K views,2 months ago,https://www.youtube.com/watch?v=h2_xRJA5nyg
BEST GADGETS FOR EASY PARENTING || Gadget VS Hack,421K views,2 months ago,https://www.youtube.com/watch?v=dmfzqOFPtwk
GENIUS EMERGENCY HACKS TO MAKE YOUR LIFE EASIER || First-Aid Hacks For Parents,150K views,2 months ago,https://www.youtube.com/watch?v=s-pH46FXwfw
MINIATURE HOUSE FOR WEDNESDAY || Doll Hacks & Mini House Models,151K views,2 months ago,https://www.youtube.com/watch?v=00Bxj0skZvs
POOR vs RICH PET OWNER || Best Gadgets And Hacks For Your Pets,67K views,2 months ago,https://www.youtube.com/watch?v=1ROpiTDAzVQ
CUTE WINTER DOLL CRAFTS || Awesome Miniature DIY Ideas,208K views,2 months ago,https://www.youtube.com/watch?v=1OVedewixIs
SMART GADGETS FOR PARENTS || Positive Parenting Guide,1M views,2 months ago,https://www.youtube.com/watch?v=MtSEUtGpSEo
BEST SCHOOL HACKS AND ART IDEAS TO BOOST YOUR CREATIVITY,127K views,2 months ago,https://www.youtube.com/watch?v=0fphJLT9nik
HOW TO BECOME A PRINCESS? || Creative Parenting Hacks,9.2M views,2 months ago,https://www.youtube.com/watch?v=XIy1ObhhGdQ
Incredible Doll Transformation || Useful Doll Hacks,126K views,2 months ago,https://www.youtube.com/watch?v=TWwpZ2NO6mk
AWESOME ART HACKS AND EASY DRAWING IDEAS FOR BEGINNERS,199K views,2 months ago,https://www.youtube.com/watch?v=tdZf1qb1wSQ
ADORABLE DOLL CRAFTS || DIY Outfits And Accessories For Dolls,159K views,2 months ago,https://www.youtube.com/watch?v=m4T4Fqoyd_c
GENIUS SCHOOL HACKS TO SOLVE YOUR PROBLEMS || Easy School Supplies Ideas,992K views,2 months ago,https://www.youtube.com/watch?v=X9hieBrNCVY
FANTASTIC PHONE CASE IDEAS TO UPGRADE YOUR PHONE,183K views,2 months ago,https://www.youtube.com/watch?v=Ub4Spr38lSs
VIRAL ART HACKS & PAINTING TECHNIQUES YOU SHOULD SEE,133K views,2 months ago,https://www.youtube.com/watch?v=ntmWof9Ai0A
BEST GADGETS FOR SMART PARENTING || How To Be A Good Parent,1.7M views,2 months ago,https://www.youtube.com/watch?v=gmCa9GT5LhA
MAKEOVER FOR HOMELESS PET || Rich Guy Save Poor Dog From the TRASH CAN!,180K views,2 months ago,https://www.youtube.com/watch?v=lbUUPQVS4k0
"CUTEST MINIATURE CRAFTS || Polymer Clay, 3D Pen, Epoxy Resin DIY Ideas",233K views,2 months ago,https://www.youtube.com/watch?v=_RLHOcP03eQ
FANTASTIC ROOM TRANSFORMATION 🌈😻 Room Makeover Ideas For Parents,100K views,2 months ago,https://www.youtube.com/watch?v=G6qXqkxC7iA
VIRAL SCHOOL HACKS AND EASY ART IDEAS FOR EVERYONE,113K views,2 months ago,https://www.youtube.com/watch?v=otgn0ZiqZT0
GENIUS DRAWING HACKS AND EASY ART IDEAS FOR BEGINNERS,135K views,2 months ago,https://www.youtube.com/watch?v=zEFRX421kLQ
SMART FEET HACKS AND GADGETS || UNUSUAL SHOE CRAFTS,380K views,2 months ago,https://www.youtube.com/watch?v=Ah2nfKOQmcc
RICH VS POOR! CREATIVE DIY TOYS FOR CRAFTY PEOPLE,114K views,2 months ago,https://www.youtube.com/watch?v=Fm716psfXF4
COOL HACKS FOR SCHOOL & EASY DIY SCHOOL SUPPLIES,422K views,2 months ago,https://www.youtube.com/watch?v=PF34UHXjSME
HOW TO BE FRIENDS WITH YOUR KID || GENIUS PARENTING HACKS,656K views,2 months ago,https://www.youtube.com/watch?v=FudaCKFl_dc
SCHOOL HACKS FOR SMART PARENTS || HOW TO MAKE YOUR KIDS HAPPY,273K views,2 months ago,https://www.youtube.com/watch?v=SJ3k52DMk0o
VIRAL FIDGET TOYS! DIY Fidget Toys You Will Love,63K views,2 months ago,https://www.youtube.com/watch?v=xpKPLj8P4wQ
GORGEOUS DOLL TRANSFORMATION || Cute Miniature Doll Crafts,156K views,2 months ago,https://www.youtube.com/watch?v=Qa9ncKDqGMI
GENIUS SCHOOL HACKS AND ART IDEAS YOU SHOULD TRY,84K views,2 months ago,https://www.youtube.com/watch?v=8jcaWjcrEwU
LOVELY CRAFTS AND GADGETS FOR YOUR PETS || Smart Hacks For Pet Owners,397K views,2 months ago,https://www.youtube.com/watch?v=dQh9cNZs7mU
RAINBOW TRANSFORMATION OF WEDNESDAY || Awesome Ideas For Doll Room Makeover,347K views,2 months ago,https://www.youtube.com/watch?v=8MjkSqyo1FY
CRAZY DOLL TRANSFORMATIONS || Creepy Doll DIYs,73K views,2 months ago,https://www.youtube.com/watch?v=hTFgWaE7DrA
VIRAL ART IDEAS AND EASY DRAWING HACKS,210K views,2 months ago,https://www.youtube.com/watch?v=UuHMb_2ESAc
GENIUS TRAVEL HACKS FOR PARENTS || USEFUL CAMPING TIPS,1.6M views,2 months ago,https://www.youtube.com/watch?v=dADKV6gqUJc
CUTE MINIATURE FOOD AND DOLLHOUSE CRAFTS,150K views,3 months ago,https://www.youtube.com/watch?v=OFC_z95jZM4
"AMAZING DIY JEWELRY || Hot Glue, Epoxy Resin, 3D Pen Crafts",210K views,3 months ago,https://www.youtube.com/watch?v=brHrpaF1cPk
COOL DIY IDEAS FOR PARENTS || How To Entertain Your Kid,139K views,3 months ago,https://www.youtube.com/watch?v=hkLjkLuj94A
INCREDIBLE FOOD HACKS AND KITCHEN GADGETS YOU SHOULD SEE,94K views,3 months ago,https://www.youtube.com/watch?v=fek1_zdJlW8
They are Alive. How to Create your Own Pokemon.,62K views,3 months ago,https://www.youtube.com/watch?v=97aigDT1_xE
"MEGA SCHOOL COMPILATION || School Hacks, DIY School Supplies and Funny Pranks",236K views,3 months ago,https://www.youtube.com/watch?v=7dI82jOeEO0
INCREDIBLE CEMENT CRAFTS FOR YOUR HOUSE AND BACKYARD,167K views,3 months ago,https://www.youtube.com/watch?v=jHTqGR_rROg
CARDBOARD CRAFTS AND TOYS FOR CRAFTY PARENTS AND THEIR KIDS,307K views,3 months ago,https://www.youtube.com/watch?v=qCxJ3NYCqoc
BEST CRAFTS FOR YOUR PET || HOMELESS CAT MAKEOVER,172K views,3 months ago,https://www.youtube.com/watch?v=Y5lgI4OotXw
VIRAL SCHOOL HACKS THAT WILL BLOW YOUR MIND,1.2M views,3 months ago,https://www.youtube.com/watch?v=_V371aLpgHQ
AWESOME DIY MINIATURE IDEAS || Cool Doll House,485K views,3 months ago,https://www.youtube.com/watch?v=MpQXBjNNChE
3 DOLL TRANSFORMATION IDEAS THAT WILL SURPRISE YOU,124K views,3 months ago,https://www.youtube.com/watch?v=TLubyiS9w4E
SMART BATHROOM HACKS FOR PARENTS AND THEIR KIDS,264K views,3 months ago,https://www.youtube.com/watch?v=v6GqiJ3_bkE
100+ BACK TO SCHOOL IDEAS AND FUN CRAFTS,817K views,3 months ago,https://www.youtube.com/watch?v=V9Jxsr19KPA
FUNNY FINGER DOODLES AND ART IDEAS,158K views,3 months ago,https://www.youtube.com/watch?v=SAU7xIV-9A8
FANTASTIC DOLL TRANSFORMATION || Easy Doll Hacks,255K views,3 months ago,https://www.youtube.com/watch?v=o0cNMGb9D1o
EASY WINTER DECOR IDEAS TO MAKE YOUR HOME COZIER,101K views,3 months ago,https://www.youtube.com/watch?v=yNsaD1UtDBE
EASY DRAWING IDEAS AND PAINTING HACKS FOR BEGINNERS,425K views,3 months ago,https://www.youtube.com/watch?v=FZIhLvSF-rY
ADORABLE POLYMER CLAY CRAFTS YOU WILL LOVE,103K views,3 months ago,https://www.youtube.com/watch?v=UaZwfLswN8I
SUMMER DOLL HACKS || Mini Doll Furniture And DIY Accessories,135K views,3 months ago,https://www.youtube.com/watch?v=QfWqiLfNT_8
BACK TO SCHOOL! Amazing School DIYs You Should Try,131K views,3 months ago,https://www.youtube.com/watch?v=g1x_UN3Tn9M
BEST PARENTING HACKS AND FUN TOYS FOR YOUR FAMILY,245K views,3 months ago,https://www.youtube.com/watch?v=9Kgt20YO54E
VIRAL SCHOOL HACKS AND ART IDEAS,267K views,3 months ago,https://www.youtube.com/watch?v=iqiEfttw3do
AMAZING HACKS AND GADGETS FOR PETS,230K views,3 months ago,https://www.youtube.com/watch?v=_LuuFaEqjxU
VACATION HACKS FOR PARENTS || SUMMER PARENTING HACKS,112K views,3 months ago,https://www.youtube.com/watch?v=XY0SgHwHlmg
MINI DOLL CRAFTS || Cutest Doll Transformation,460K views,3 months ago,https://www.youtube.com/watch?v=XO2_pq9HVVM
GENIUS HACKS FOR PET OWNERS || USEFUL GADGETS FOR PETS,148K views,3 months ago,https://www.youtube.com/watch?v=PBvIiIYDnT4
VALUABLE GADGETS FOR PARENTS || Cool Hacks And DIYs For Crafty Parents,190K views,3 months ago,https://www.youtube.com/watch?v=0ECAqLYFcXE
SMART PAINTING HACKS AND COOL ART IDEAS,677K views,3 months ago,https://www.youtube.com/watch?v=_1fHv50VuPc
SMART BATHROOM HACKS YOU NEED TO TRY,1M views,3 months ago,https://www.youtube.com/watch?v=mEcAn-t1V_4
DIY BACKYARD POOL FOR YOUR KIDS || EASY SUMMER CRAFTS FOR BACKYARD,926K views,3 months ago,https://www.youtube.com/watch?v=dx1_PvBETIE
HOW TO SNEAK SNACKS INTO CLASS || Hilarious Food Hacks And Tricks,195K views,3 months ago,https://www.youtube.com/watch?v=bZAyOkARuhQ
INCREDIBLE SHOE DIY IDEAS || How To Upgrade Boring Shoes,357K views,3 months ago,https://www.youtube.com/watch?v=KZ9oXM3ntd4
BROKE MOM vs RICH MOM || Easy DIY Ideas To Surprise Your Kid,189K views,3 months ago,https://www.youtube.com/watch?v=-vAK6UDkwhQ
