Video Heading,Total Views,Video Uploaded,Video Link
"HOT! 🔥 MOBILE PHOTOGRAPHY IDEAS || Make your photos and videos go viral in Instagram, TikTok",803K views,1 year ago,https://www.youtube.com/watch?v=SgU22ZMDey4
WOW! 🤯 FANTASTIC EXPERIMENTS THAT WILL BLOW YOUR MIND,1.1M views,1 year ago,https://www.youtube.com/watch?v=SiD7HS7j9hk
SHOCKING COMMERCIAL TRICKS WITH FOOD || Amazing Cooking Hacks WITH FOOD,2M views,1 year ago,https://www.youtube.com/watch?v=AakARCMfu00
🏖 PATIO DESIGN IDEAS FOR SUMMER || Home Decorating Tips,1.9M views,1 year ago,https://www.youtube.com/watch?v=AsuokqGmMz4
RICH Student vs BROKE Student || Rich Girl VS Poor Girl Funny Moments and Cool Hacks,1.7M views,1 year ago,https://www.youtube.com/watch?v=ExL8HG2PuQI
MEGA COMPILATION || SMART PARENTING LIFE HACKS,2.4M views,1 year ago,https://www.youtube.com/watch?v=ULo4wE1UdzU
FAKE PIERCINGS & TATTOOS THAT LOOK REAL! EFFECTIVE BEAUTY HACKS,562K views,1 year ago,https://www.youtube.com/watch?v=EB6X0_OrxZU
Incredible life hacks for parents || How To Make Kids Happier,1.2M views,1 year ago,https://www.youtube.com/watch?v=0XJ-MPBlZN8
IF OBJECTS WERE PEOPLE || Relatable Situations & Fun Life Hacks,27M views,1 year ago,https://www.youtube.com/watch?v=RDWSz-h84PA
Important First Aid Hacks for Emergencies That You Need to Know,454K views,1 year ago,https://www.youtube.com/watch?v=bs3xjOhEowo
WATERMELON PARTY HACKS 🍉 Amazing Party Tricks For Friends and Family,785K views,1 year ago,https://www.youtube.com/watch?v=WD-f0w0pToc
Smart Gadgets For All Occasions || 26 amazing gadgets to make parenting easier,2M views,1 year ago,https://www.youtube.com/watch?v=8ByR8LUR-7s
BEST PARENTING LIFE HACKS || Smart Tips for Parents,20M views,1 year ago,https://www.youtube.com/watch?v=bNqIyuni1ZY
HOW TO ESCAPE AWKWARD SITUATIONS | If food were people,642K views,1 year ago,https://www.youtube.com/watch?v=oZUtvBke7eA
PARENTING LIFE AND HACKS || Awesome TIPS from moms and grandmas,377K views,1 year ago,https://www.youtube.com/watch?v=SkhUSbr6RkU
FANTASTIC HOME DECOR IDEAS TO MAKE YOUR PLACE COZIER,566K views,1 year ago,https://www.youtube.com/watch?v=N6AoczKS560
Is It Hard To Be a MOM? SMART LIFE HACKS FROM CRAFTY PARENTS,4.5M views,1 year ago,https://www.youtube.com/watch?v=OQuDzNdD6zk
Crazy toothpaste hair DYE! Will it work? || Two Girls Cut Their Clothes In Public,580K views,1 year ago,https://www.youtube.com/watch?v=9I_OmoMn6q4
GREAT TIPS TO AVOID AWKWARD SITUATIONS,305K views,1 year ago,https://www.youtube.com/watch?v=8axruaRCt4Q
100+ PARENTING HACKS || HOW HARD IS TO BE A MOM,8.4M views,1 year ago,https://www.youtube.com/watch?v=2L8QXYO0Dik
IF MAKEUP WERE PEOPLE! If Food Were People!,1.6M views,1 year ago,https://www.youtube.com/watch?v=FWyBazm2hWI
POP IT! SATISFYING SOAP DIY IDEAS || How to Make Soap at Home,423K views,1 year ago,https://www.youtube.com/watch?v=6Po-4_ieij4
POP IT! COLORFUL DIYs and COOL HACKS FOR EVERYONE,1.2M views,1 year ago,https://www.youtube.com/watch?v=cW0Gf1s_Y9A
"Creative DIYs and Crafts To Try! || Glue gun, 3D pen, Soap and Epoxy Resin Ideas You Will Adore.",619K views,1 year ago,https://www.youtube.com/watch?v=zhGIXD-HffI
AWESOME RECYCLING IDEAS FOR YOUR HOME DECOR,397K views,1 year ago,https://www.youtube.com/watch?v=L5ucjDC3zEo
13 Clever Ways to Keep Your Child Happy! Studying has never been so fun!,151K views,1 year ago,https://www.youtube.com/watch?v=jbZLyqTywzI
POP IT! CAMPING HACKS & SURVIVAL TIPS YOU NEED TO KNOW,1.3M views,1 year ago,https://www.youtube.com/watch?v=Q7oqbR0cr5g
MEGA GLUE GUN COMPILATION FOR CRAFTY PEOPLE BY 5-MINUTE CRAFTS,815K views,1 year ago,https://www.youtube.com/watch?v=zgHmDg-IwUs
AWESOME EVERYDAY HACKS EVERY PARENT SHOULD TRY,1.9M views,1 year ago,https://www.youtube.com/watch?v=v02MWcwh0iU
GIRLS and BOYS DO IT all the time || Cool Life Hacks and Pranks to Try with Friends,367K views,1 year ago,https://www.youtube.com/watch?v=iMtTf-d4d4E
POP IT! 23 Cool Parenting Life Hacks For New Moms And Dads,17M views,1 year ago,https://www.youtube.com/watch?v=DpXBl9CRFU4
Smart Hacks To Make Parenting Ten Times Easier,6.8M views,1 year ago,https://www.youtube.com/watch?v=P1GT2N1OZnI
HOT GLUE GUN and 3D PEN HACKS | 29 Cool Hacks And Crafts For You,685K views,1 year ago,https://www.youtube.com/watch?v=bIGWEcvbGpk
Budget Bathroom Renovation Ideas || Renovate your home easily and cheaply,481K views,1 year ago,https://www.youtube.com/watch?v=mvcvZTmf-5o
33 GARDENING HACKS || How To Grow Any Plants At Home,370K views,1 year ago,https://www.youtube.com/watch?v=jghHddgBx10
WEDDING HACKS || Couple Transformation and DIY Jewelry for The Most Special Day of Your Life,1.4M views,1 year ago,https://www.youtube.com/watch?v=fejANz5J2Ic
25 COOL LIFE HACKS FOR EVERY OCCASION,1.9M views,1 year ago,https://www.youtube.com/watch?v=2jlORMmA1eY
MEGA COMPILATION FOR SMART PARENTS BY 5-MINUTE CRAFTS,30M views,1 year ago,https://www.youtube.com/watch?v=v2RSjkpMp0o
GLUE GUN VS 3D PEN! This is a new level of crafting,3M views,1 year ago,https://www.youtube.com/watch?v=2lLSBgD1eBs
Don’t Throw Away Cardboard! Hamster Maze and Fantastic DIY Old Things Recycle Ideas,712K views,1 year ago,https://www.youtube.com/watch?v=C9U419Htbmc
YUMMY FOOD IDEAS || 30 Simply Eggs Recipes That Will Melt In Your Mouth,641K views,1 year ago,https://www.youtube.com/watch?v=qc4MNzqFvLY
Girls Problems With Short VS Long Hair || LONG NAILS STRUGGLES,1.5M views,1 year ago,https://www.youtube.com/watch?v=F43zWsPdzfc
"HOW TO HAVE FUN WITH FRIENDS || 21 Hacks to Get Snacks, Makeup and Pets into a Party",669K views,1 year ago,https://www.youtube.com/watch?v=E8XqQERDmPo
"HOT GLUE GUN IDEAS || 20 Cool DIY Projects with 3D Pen, Epoxy Resin be 5-Minute Crafts",2.5M views,1 year ago,https://www.youtube.com/watch?v=-QTGRnFup6Y
Last Minute Easter Decorating Ideas || Lovely Crafts To Keep Your Child Happy,414K views,1 year ago,https://www.youtube.com/watch?v=CvANP3DOcBo
5 Miniature DIYs That Parents and Kids will Enjoy! Crafts for @Cave Club!,186K views,1 year ago,https://www.youtube.com/watch?v=11cNVEBucA4
25 Viral TIK TOK Hacks || HOW TO SNEAK FRIENDS into the movies,736K views,1 year ago,https://www.youtube.com/watch?v=dAQYHhjS228
SMART PARENTING LIFE AND HACKS || Clever Ideas And Funny Situations By 5-Minute Crafts,9.1M views,1 year ago,https://www.youtube.com/watch?v=KZKlILI1RJg
Help us bring the trophy home!,461K views,1 year ago,https://www.youtube.com/watch?v=WGtGxPLDe2s
29 SUMMER LIFE HACKS || TikTok Trends And Viral Hacks You Will Enjoy,1.2M views,1 year ago,https://www.youtube.com/watch?v=DwlJl2ba3rs
DIY Dolls House Miniature. Take a Photo in this Tiny Photo Studio!,286K views,1 year ago,https://www.youtube.com/watch?v=iyZBlAWQ9nE
FIRST AID HACKS || 23 Safety Tricks For Common Problems,3.4M views,2 years ago,https://www.youtube.com/watch?v=UdED9vldYJw
SMART PARENTING LIFE AND HACKS || Clever Ideas And Funny Situations By 5-Minute Crafts,3.4M views,2 years ago,https://www.youtube.com/watch?v=7yF7RFNQcJo
22 CLEVER CAMPING IDEAS For Your Next Trip!,1.6M views,2 years ago,https://www.youtube.com/watch?v=o--S2j7i-JU
22 CLEVER CAMPING IDEAS For Your Next Trip! (Trailer),289K views,2 years ago,https://www.youtube.com/watch?v=XiJNRWpFmvw
HOT GLUE GUN HACKS || Best Glue Gun & 3D Pen Ideas by 5-Minute Crafts,2.7M views,2 years ago,https://www.youtube.com/watch?v=q1JsZzPV5zw
AMAZING DIY IDEAS FROM EPOXY RESIN || 22 easy epoxy resin crafts and jewelry,3M views,2 years ago,https://www.youtube.com/watch?v=swD7peONcaE
16 PARENTING HACKS YOU NEED TO KNOW|| Cool Ideas To Make Parenting Easier,1.4M views,2 years ago,https://www.youtube.com/watch?v=7wkMI-xqay0
WINTER CAMPING IDEAS || 14 Life-Saving Camping Hacks You Will Definitely Like,1.7M views,2 years ago,https://www.youtube.com/watch?v=BAT2hLp6muM
18 SMART LIFE HACKS FOR EVERY OCCASION || Creative 3D Pen Ideas by 5-Minute Crafts,2.5M views,2 years ago,https://www.youtube.com/watch?v=BzNqG0TBz1s
WE TRIED crazy PHONE HACKS to see if they actually work,2.5M views,2 years ago,https://www.youtube.com/watch?v=jMbovU8VTHM
How To Hide Candy From a Child! 17 Brilliant Ways To SNEAK SNACKS & Food,1.5M views,2 years ago,https://www.youtube.com/watch?v=1kxb11UQ-OU
20 GENIUS ORGANIZING HACKS | Cool Ideas And DIY Crafts To Transform Your Home,6.2M views,2 years ago,https://www.youtube.com/watch?v=aCtm60gOWMw
3D PEN HACKS || Unbelievable things you can do with a 3D pen and hot glue,2.7M views,2 years ago,https://www.youtube.com/watch?v=Zp-bTeKb7qg
21 AMAZING PLANTS IDEAS || DIY Gardening Tricks You Should Know,34M views,2 years ago,https://www.youtube.com/watch?v=dSyzaiISa_c
15 AWKWARD MOMENTS || BEAUTY AND MAKEUP HACKS FOR A GORGEOUS LOOK,5.8M views,2 years ago,https://www.youtube.com/watch?v=U8dLGVC6laE
"YUM! 22 EASY FAST FOOD HACKS || Cooking Ideas, Tricks To Avoid Fails In Kitchen",5.2M views,2 years ago,https://www.youtube.com/watch?v=ON3eF9gCDr8
16 Cool Decor Ideas and DIY Furniture || GENIUS SOLUTIONS FOR YOUR HOME,1.8M views,2 years ago,https://www.youtube.com/watch?v=Pyia51vIgL4
"SNEAK SNACKS Anywhere You Go! | Awesome Ways to SNEAK FOOD Into Hospital, School, Club",3.5M views,2 years ago,https://www.youtube.com/watch?v=wQwue2MBe-Q
15 DIY CARDBOARD CRAFTS || Easy Upgrade Hacks and Plastic Recycle Ideas,2.5M views,2 years ago,https://www.youtube.com/watch?v=xBEH0tSUMHA
29 PARENTING HACKS AND GADGETS || Cool life hacks and funny ideas for parents,16M views,2 years ago,https://www.youtube.com/watch?v=V2FKD3xYLUg
27 BEST TRICKS || Secrets Of Best Magic Tricks And Funny Hacks by 5-Minute Crafts,2.2M views,2 years ago,https://www.youtube.com/watch?v=rPZScSxSK40
COUPLES PRANKS || 22 Funny Life Hacks and Gift Ideas,5.5M views,2 years ago,https://www.youtube.com/watch?v=FADD5_nANBs
3D PEN VS GLUE GUN! 17 Cool Hacks And Crafts For You,23M views,2 years ago,https://www.youtube.com/watch?v=NI0PngB4-XQ
3D PEN CRAFTS || 30 simple hacks to make your life easier,4.5M views,2 years ago,https://www.youtube.com/watch?v=vJRoXZVHOyQ
28 PARENTING HACKS From Crafty Moms And Dads || Tips for Being Friends with Your Child,35M views,2 years ago,https://www.youtube.com/watch?v=2j69K3ozCjA
We tried building an igloo in the backyard and here's what happened,3.7M views,2 years ago,https://www.youtube.com/watch?v=_Vd1aWLZZ40
23 SMART LIFE HACKS FOR EVERY OCCASION,15M views,2 years ago,https://www.youtube.com/watch?v=9ZgVg4d2xLA
31 Clothing Hacks Everyone NEEDS To Try || Fashion Tricks Everyone Must Know!,4.4M views,2 years ago,https://www.youtube.com/watch?v=ASGRB47_pxo
26 BEST LIFE HACKS || Cool 3D Pen Crafts and Parenting Ideas Of All Time,7.1M views,2 years ago,https://www.youtube.com/watch?v=trRMuyCt9gg
DIY CAR MADE FROM RUBBISH || Cool Craft From Nuts and Bolts,3.7M views,2 years ago,https://www.youtube.com/watch?v=ZMPPh3n65iM
22 BRILLIANT CLOTHES HACKS || Cool DIY Upgrade Ideas by 5-Minute Crafts,19M views,2 years ago,https://www.youtube.com/watch?v=Dpg-qq2j_6I
WE TESTED VIRAL Tik Tok HACKS TO SEE IF THEY WORK | 23 Ideas And Tricks You Should Know,19M views,2 years ago,https://www.youtube.com/watch?v=n14Emy6pRyU
Amazing Microscopic World! Common Objects Under The Microscope || HOME EXPERIMENTS,6.6M views,2 years ago,https://www.youtube.com/watch?v=-gpDNNnmVT0
COOL TINY DIYs YOU CAN MAKE IN 5 MINUTES,878K views,2 years ago,https://www.youtube.com/watch?v=NPzlzkqomvo
28 SMART HACKS AND CRAFTS || Bathroom and Toilet Fails and Funny Moments,2.7M views,2 years ago,https://www.youtube.com/watch?v=vOCqUs2V42U
15 EASY AND AMAZING DOLL PARTY DIYS | CELEBRATE WITH CAVE CLUB!,909K views,2 years ago,https://www.youtube.com/watch?v=ynXJQYVQGxU
AWKWARD MOMENTS WE CAN ALL RELATE TO |18 HACKS WITH 3D PENS AND GLUE GUNS THAT SHOULD HELP YOU,11M views,2 years ago,https://www.youtube.com/watch?v=R_xbGUg85WY
LAST MINUTE CHRISTMAS DIY CRAFTS | COOL IDEAS WITH GLUE GUN AND OTHER SIMPLE THINGS,4.3M views,2 years ago,https://www.youtube.com/watch?v=2hGvRiThLzk
19 DIY TOYS FOR KIDS || WINTER HOLIDAY CRAFTS AND IDEAS FOR LITTLE PEOPLEⓇ TOYS BY FISHER-PRICEⓇ,1M views,2 years ago,https://www.youtube.com/watch?v=LjQY8ZaKKrg
COOL WINTER HOLIDAY HACKS || Gift Ideas and Funny Crafts with Thomas & Friends™,751K views,2 years ago,https://www.youtube.com/watch?v=wvURFgWR1YI
3D PEN CRAFTS || 15 Cool DIY Ideas You Need To Try,19M views,2 years ago,https://www.youtube.com/watch?v=ksiQOQIuIng
14 COOL DIYS FOR DOLLS | HAVE FUN WITH CAVE CLUB!,534K views,2 years ago,https://www.youtube.com/watch?v=Z1-Yu1AJFYs
AWESOME FASHION LOOKS WITH INKBOX TATTOOS | THEY LOOK SO REAL!,991K views,2 years ago,https://www.youtube.com/watch?v=OWTEUxgwHDo
CHRISTMAS DECOR AND GIFT IDEAS || Cool DIY Crafts and Gift Wrapping Hacks For Winter Holidays,2.2M views,2 years ago,https://www.youtube.com/watch?v=y11XkfRtxaA
AWESOME HACKS AND SCHOOL SUPPLIES IDEAS || 5-Minute Tips For Smart Students,4.6M views,2 years ago,https://www.youtube.com/watch?v=4MizRUKbagU
Hot glue is back! 21 GLUE GUN HACKS and DIYs by 5-Minute Crafts,9.7M views,2 years ago,https://www.youtube.com/watch?v=ae7Ar6f5-30
DIY MINIATURE HOUSE FROM LITTLE BRICKS AND CEMENT by 5-Minute Crafts,17M views,2 years ago,https://www.youtube.com/watch?v=IFV6X8vqXuU
"YUM! 18 Crazy Ways to SNEAK SNACKS Anywhere You Go || How to Sneak Food Into The Movies, Into Class",20M views,2 years ago,https://www.youtube.com/watch?v=uevl8RsuTq8
SATISFYING SLIME HACKS || Relaxing ASMR video by 5-Minute Crafts,2M views,2 years ago,https://www.youtube.com/watch?v=IbtHwE-fbEM
19 DIY T-SHIRT DESIGNS YOU CAN MAKE AND SELL IN 5 MINUTES || How To Start An Online Business,1.9M views,2 years ago,https://www.youtube.com/watch?v=y71xodUTjis
COOL FOOD HACKS AND FUNNY TRICKS || 27 FOODS YOU CAN WAFFLE IRON!,6.1M views,2 years ago,https://www.youtube.com/watch?v=LvD3TIjDd0s
Welcome to our TREEHOUSE! Easy DIY Project For Beginners with Pallets and Workshop Gadgets,6.4M views,2 years ago,https://www.youtube.com/watch?v=6VhEKTo2B5I
I NEED IT! 28 smart gadgets for your home and kitchen || Organization hacks and ideas,3.1M views,2 years ago,https://www.youtube.com/watch?v=r-KNYcxFxxg
POPULAR VS NERD STUDENT. 12 DIY school pranks and hacks by 5-Minute crafts,3.9M views,2 years ago,https://www.youtube.com/watch?v=rzTC61xsiD0
REUSE! 27 Easy Hacks & DIY Ideas to Recycle Anything by 5-Minute Crafts,7M views,2 years ago,https://www.youtube.com/watch?v=HdO6F2ivWWQ
"25 EASY DECOR IDEAS || DIY Slime, Candle Crafts And Notebook Decor",1.8M views,2 years ago,https://www.youtube.com/watch?v=9V1zYa1LiVs
"HALLOWEEN PRANKS AND DIYs || Spooky Makeup And Costumes Ideas, Crazy Halloween Room Decor",2.2M views,2 years ago,https://www.youtube.com/watch?v=LgnW8ChukFs
COOL HALLOWEEN DECOR AND COSTUMES YOU CAN DIY IN NO TIME,9.5M views,2 years ago,https://www.youtube.com/watch?v=2myNLIvIBEs
"32 CLEVER FOOD HACKS TO MAKE IN 5 MINUTES || Tasty Recipes, Baking Tips And Kitchen Hacks",2.3M views,2 years ago,https://www.youtube.com/watch?v=Cwn7gZNew_c
"26 OF THE MOST SATISFYING LIFE HACKS EVER || SLIME AND JELLY DIYs, SCIENCE AND MAGIC TRICKS",1.2M views,2 years ago,https://www.youtube.com/watch?v=N8I7EnwSYVM
We TESTED Viral TikTok Hacks || 20 HANDY LIFE HACKS FOR ANY OCCASION TO MAKE YOUR LIFE EASIER,1.9M views,2 years ago,https://www.youtube.com/watch?v=nUGGymkY0tI
VILLAGE FOOD ASMR || My 83 Years Grandma Cooking Pasta || Delicious Homemade Food And Recipes,700K views,2 years ago,https://www.youtube.com/watch?v=nu_LGYxDYag
SATISFYING PAINTING ART || Acrylic Pouring Paint Techniques || How to PAINT for beginners,2.6M views,2 years ago,https://www.youtube.com/watch?v=u7kX3a-6SLM
"FAKE SPONGE CAKE || 25 Crazy And Quick DIY Hacks | Clean, Tidy Up And Organize Your House",981K views,2 years ago,https://www.youtube.com/watch?v=msmxXwkVQhg
"MACHINE GUN FROM A DRILL || 12 Cool Crafts To Make At Home, Recycle DIYs",1.1M views,2 years ago,https://www.youtube.com/watch?v=ZRXd6lstRYs
27 PLANT AND GARDEN HACKS || Easy Ways To Grow Seeds And DIY Backyard Upgrades,3.6M views,2 years ago,https://www.youtube.com/watch?v=obCT76j8wFM
33 HACKS TO FIX ANYTHING QUICKLY || Repair Life Hacks And Gadgets,1.7M views,2 years ago,https://www.youtube.com/watch?v=6EaqpeTad-8
31 SMART PARENTING HACKS AND GADGETS || DIY Clothes Ideas And Easy Activities Every Mom Should Know,22M views,2 years ago,https://www.youtube.com/watch?v=bfLd-QJdp1s
31 UNEXPECTED BEAUTY HACKS || Girly Tips And Tricks || Makeup Ideas And Clothes Recycling DIYs,2.9M views,2 years ago,https://www.youtube.com/watch?v=7k7uNMQNl7E
"28 CAMPING GADGETS YOU NEED || Outdoors And Travel Hacks And Tricks, Must-Know Survival Tips",3.6M views,2 years ago,https://www.youtube.com/watch?v=AFkK6gm5HOE
29 GENIUS LIFE HACKS FOR EVERYDAY SITUATIONS || DIY Tips And Tricks To Make Your Life Easier,2.1M views,2 years ago,https://www.youtube.com/watch?v=nDtTOkPmidk
UPGRADE YOUR OLD CLOTHES IN A MINUTE || Creative ANd Quick Clothes Ideas And Alterations,1.8M views,2 years ago,https://www.youtube.com/watch?v=UbV_cgSu6GE
CRAZY WATERMELON IDEAS || 25 Kitchen Tips And Cooking Ideas For Any Occasion,1.3M views,2 years ago,https://www.youtube.com/watch?v=kDJz1356L-Y
"BUILD A HOUSE WITH WOODEN PALLETS || 23 DIY PROJECTS WITH EPOXY AND WOOD, WORKSHOP GADGETS",2.1M views,2 years ago,https://www.youtube.com/watch?v=ZRL76ZvYlOg
"28 LATEST GADGETS YOU NEED IN YOUR LIFE || KITCHEN, SUMMER, CAMPING, BEACH GADGETS AND HACKS",2.5M views,2 years ago,https://www.youtube.com/watch?v=1V-kL0BaZ1k
33 AMAZING CHOCOLATE AND PASTRY IDEAS || DIY Kitchen Hacks And Simple Dessert Recipes,1.7M views,2 years ago,https://www.youtube.com/watch?v=P-jAY7V7wJM
3D PEN CAN FIX YOUR LIFE || 36 REUSE AND RECYCLE CRAFTS AND DIYs || DIY Helicopter And BBQ Grill,12M views,2 years ago,https://www.youtube.com/watch?v=72aRKbj4ZIs
WEIRD BEAUTY AND HAIR GADGETS TESTED || 32 Beauty Tricks And Makeup Hacks For Girls,2.1M views,2 years ago,https://www.youtube.com/watch?v=Ny4DvQrCOH4
FUNNY THINGS ONLY GIRLS UNDERSTAND || Clever Life Hacks For Girls And Relatable Couple Situations,2.4M views,2 years ago,https://www.youtube.com/watch?v=1pAkIPdzeZ0
29 Fantastic Plant Hacks And DIY Gardening Ideas || GARDEN GADGETS AND TOOLS,7.6M views,2 years ago,https://www.youtube.com/watch?v=W5-7U0W6ILk
HUGE DIY BOAT || 25 AWESOME RECYCLING CRAFTS YOU CAN MAKE FROM OLD STUFF,3.1M views,2 years ago,https://www.youtube.com/watch?v=00qJJZVVLTw
"COOL 3D PEN CRAFTS || 31 DIY DECOR IDEAS, CEMENT AND PAINT CRAFTS",7.2M views,2 years ago,https://www.youtube.com/watch?v=vwb0uwwnIPQ
ХХ CLEVER CAMPING IDEAS || DIY TRAVEL HACKS TO HELP YOU ON A TRIP,18M views,2 years ago,https://www.youtube.com/watch?v=ovMRb7atXvg
XX HACKS AND CRAFTS TO SOLVE YOUR EVERYDAY PROBLEMS || How To Relax And Make Your Life Easier,2.1M views,2 years ago,https://www.youtube.com/watch?v=JDPLtRAbpq0
"36 INCREDIBLE GADGETS YOU NEED TO TRY || Kitchen, Travel, Sewing, Pet Gadgets And Tools",2.8M views,2 years ago,https://www.youtube.com/watch?v=Vx-nwsk1ECw
MINIATURE CRAFTS || 20 Cute And Useful DIYs And Decor Ideas,2.2M views,2 years ago,https://www.youtube.com/watch?v=8PN422dMHRM
"37 GIRLY HACKS FOR ANY OCCASION || Clothes And Beauty Life Hacks, Makeup And Hair Transformations",1.8M views,2 years ago,https://www.youtube.com/watch?v=Gqlm9l_O-20
"36 DIY HOME DECOR || Recycling Toys, Shells, Bottles, Cans And Tins",1.2M views,2 years ago,https://www.youtube.com/watch?v=svCvtxnqktQ
"33 HANDY EVERYDAY LIFE HACKS || Genius DIY Ideas For Cleaning, Organization, Glue Gun And Slime",15M views,2 years ago,https://www.youtube.com/watch?v=xY46caoQVC0
27 Stunning Clothing Tricks That Will Save Your Money,1.5M views,2 years ago,https://www.youtube.com/watch?v=8whHr6fTUPk
24 Kitchen Hacks To Save Your Time And Money,872K views,2 years ago,https://www.youtube.com/watch?v=E9fy2KKLIGQ
32 Sweet Summer Ideas And Recipes,984K views,2 years ago,https://www.youtube.com/watch?v=HL2S-cKlTyk
27 Watermelon Party Hacks and Ideas,410K views,2 years ago,https://www.youtube.com/watch?v=Gb4bTchkCFg
AMAZINGLY COOL MINIATURE DIY FOOD IDEAS,1.9M views,2 years ago,https://www.youtube.com/watch?v=u85aM-USXp4
"29 Unbelievable Food Ideas You Need To Try || Easy Recipes, Kitchen Tips And Tricks",736K views,2 years ago,https://www.youtube.com/watch?v=QCTMr2Ej4tY
28 Satisfying Slime Hacks You Need To Try,2.8M views,2 years ago,https://www.youtube.com/watch?v=PyAzA996FMc
28 Awesome Recipes And DIYs You Can Make Yourself,306K views,2 years ago,https://www.youtube.com/watch?v=9Lz0Y93HwxM
26 Fantastic Beauty Tricks That Will Make Your Skin Shine,554K views,2 years ago,https://www.youtube.com/watch?v=OXdXpDHTaRA
Sneaking pets || 33 Weird hacks and tricks for pet owners,2.6M views,2 years ago,https://www.youtube.com/watch?v=88HmpV4wPcg
30 Amazing Hacks For A White Smile || Beauty Tricks and Tips,7.6M views,2 years ago,https://www.youtube.com/watch?v=RDwJAjjEBZI
Food Ideas || Colorful snacks and desserts for your summer party,492K views,2 years ago,https://www.youtube.com/watch?v=DqWOCoaEQB8
DIY Fake Piercings At Home || 28 Creative Girly DIYs and Hacks,10M views,2 years ago,https://www.youtube.com/watch?v=0uJl8LrJXRY
MINI SWORD || 5 SHARP MINI DIYs AND CRAFTS,267K views,2 years ago,https://www.youtube.com/watch?v=9p-Xi6gM__4
26 Simple Solutions To Everyday Girls’ Problems You Can Relate To,828K views,2 years ago,https://www.youtube.com/watch?v=brqbSVmFju0
"25 Incredibly Simple Food Ideas, Recipes And Tricks",4M views,2 years ago,https://www.youtube.com/watch?v=Ik5vGtIe3TA
29 FUNNY PRANKS ON FRIENDS AND ROOMMATES,2.3M views,2 years ago,https://www.youtube.com/watch?v=h0ZSY3rboOs
23 Brilliant DIY Ideas For Your Cozy Home,384K views,2 years ago,https://www.youtube.com/watch?v=THQ-U9r3wuw
25 MOST SATISFYING HACKS TO BEAT STRESS || Smart Hacks For Any Occasion,2.1M views,2 years ago,https://www.youtube.com/watch?v=VJ31U6pl8_w
Weird Makeup Hacks From Artists,465K views,2 years ago,https://www.youtube.com/watch?v=943LGivH500
26 Crazy Party Hacks And DIYs || EASY PARTY TRICKS FOR FRIENDS,272K views,2 years ago,https://www.youtube.com/watch?v=0Oaj2bxlVyo
31 Fashion Hacks And Tips,253K views,2 years ago,https://www.youtube.com/watch?v=6-7E5cSwsY8
BACK TO SCHOOL IDEAS AND TRICKS || 25 Genius Hacks For Smart Students,357K views,2 years ago,https://www.youtube.com/watch?v=TOuVFd_PeQw
Crazy Manicure Ideas || 27 Beauty Hacks Every Girl Should Know,4.7M views,2 years ago,https://www.youtube.com/watch?v=5Cif6Z0dVcc
38 Useful Clothing Hacks For You,338K views,2 years ago,https://www.youtube.com/watch?v=cvnrH56ew9g
32 Jaw-Dropping Mini Crafts That Look So Real,248K views,2 years ago,https://www.youtube.com/watch?v=Db1fwxDP-m4
26 Awesome Slime Hacks Everyone Should Know,662K views,2 years ago,https://www.youtube.com/watch?v=H-jxXk3CNzI
29 Cool Resin Crafts To Make In A Minute,544K views,2 years ago,https://www.youtube.com/watch?v=XPU2t43v1AI
30 Cool Recycling DIYs With Plastic Bottles That Will Save You Money,294K views,2 years ago,https://www.youtube.com/watch?v=Mv5tox4psL0
32 Genius Cleaning Gadgets And Tricks You Need To Try,1.1M views,2 years ago,https://www.youtube.com/watch?v=BAohpHRVOX8
29 Egg Recipes That Will Melt In Your Mouth,799K views,2 years ago,https://www.youtube.com/watch?v=ST2YdRu9zY4
"36 Fun Food Tricks || Butter, Banana, Noodles And Egg Ideas",731K views,2 years ago,https://www.youtube.com/watch?v=2BBwxkgf77c
32 Mini Crafts That Will Make You Smile,509K views,2 years ago,https://www.youtube.com/watch?v=MKKQzywbVdg
32 Amazing Kitchen Life Hacks You Can't Miss,1.5M views,2 years ago,https://www.youtube.com/watch?v=1-5zI3EC8Q4
How to Improve Your Manicure Skills || 33 Nail Design Ideas,372K views,2 years ago,https://www.youtube.com/watch?v=hYmwfiWMCXY
"23 Amazing Egg Hacks You Have To Try || Easy Recipes, Cooking Tips And Tricks",410K views,2 years ago,https://www.youtube.com/watch?v=pjw3k20Ag2c
HOW TO LOOK YOUNGER || 38 Easy Beauty Tips And Tricks,264K views,2 years ago,https://www.youtube.com/watch?v=CH8GFl5snKE
24 Ingenious Girly Ideas You Need To Try,2.3M views,2 years ago,https://www.youtube.com/watch?v=HP_6W1Y-SRs
30 Splendid Nail Art Ideas For Everyone,360K views,2 years ago,https://www.youtube.com/watch?v=JQ4m7VwDsMM
34 Outstanding Recycling DIYs,516K views,2 years ago,https://www.youtube.com/watch?v=OXgQF3rYOj4
28 Clever Cleaning Tips That Will Save You Time,353K views,2 years ago,https://www.youtube.com/watch?v=5z8kKFv5-Bc
36 Cool And Simple DIY Ideas,533K views,2 years ago,https://www.youtube.com/watch?v=g29gluomeJg
34 Creative Ways To Use Old Toys || Smart Recycle And Reuse DIY Ideas,356K views,2 years ago,https://www.youtube.com/watch?v=U--X3rgEOhA
30 Crazy Ideas For Your Party,216K views,2 years ago,https://www.youtube.com/watch?v=jRUDDA5cbvs
25 GLUE GUN AND 3D PEN HACKS || Easy DIY Doll Remakes,23M views,2 years ago,https://www.youtube.com/watch?v=0Pb9nXHuaf4
27 Superb Slime Hacks You Should Try,469K views,2 years ago,https://www.youtube.com/watch?v=DXx4lwfcwWg
Must Have Kitchen Gadgets || 31 COOL AND EASY WAYS TO COOK EGGS AT HOME,1.3M views,2 years ago,https://www.youtube.com/watch?v=qT6ETcEnhac
26 Funny Pranks and Hacks You Wish You Knew Sooner,1.9M views,2 years ago,https://www.youtube.com/watch?v=YL4pQzXcV-Y
Decor Ideas || One Dollar Cement And Polymer Crafts For Your Home,132K views,2 years ago,https://www.youtube.com/watch?v=FoqvoonAzTI
22 Genius Ways To Reuse Plastic Bottles - Must Try DIY Crafts,454K views,2 years ago,https://www.youtube.com/watch?v=iN0je6855D0
Pedicure And Manicure Nail Transformations || 20 Crazy And Effective Beauty Hacks,241K views,2 years ago,https://www.youtube.com/watch?v=pVx3Sxswl7c
23 Brilliant Ideas To Organize Your Space,3.6M views,2 years ago,https://www.youtube.com/watch?v=bUjkpnM4AJw
26 Useful Hacks For Your Next Trip,277K views,2 years ago,https://www.youtube.com/watch?v=hf0TV-MNjYw
